{
  "source": "",
  "scraped_at_hour": "YYYY-MM-DDTHH:00:00Z",
  "scraped_at_timestamp": "YYYY-MM-DDTHH:mm:ssZ",
  "country_code": "IN",
  "city": "",
  "route_type": "non_airport",
  "pickup_latitude": 0,
  "pickup_longitude": 0,
  "pickup_zone": "",
  "pickup_address": null,
  "drop_latitude": 0,
  "drop_longitude": 0,
  "route_distance": null,
  "drop_zone": "",
  "drop_address": null,
  "vehicle_name": null,
  "vehicle_category": "",
  "vehicle_id": "",
  "vehicle_capacity": null,
  "tag_line": null,
  "is_fixed_fare": null,
  "surge_multiplier": null,
  "fare_range_string": null,
  "currency": "",
  "upfront_fare": null,
  "min_fare": null,
  "max_fare": null,
  "base_fare": null,
  "minimum_charge": null,
  "cancellation_charge": null,
  "per_distance_charge": null,
  "per_minute_wait_charge": null,
  "per_minute_ride_charge": null,
  "safe_ride_charge": null,
  "other_charge": [],
  "vehicle_eta": null,
  "estimated_trip_time": null,
  "estimated_total_trip_time": null,
  "threshold_wait_time": null,
  "threshold_cancel_time_by_driver": null,
  "threshold_cancel_time_by_passenger": null,
  "threshold_distance_by_passenger": null,
  "sorry_message": null,
  "client": null,
  "other_distance": [],
  "other_time": [],
  "is_error": false,
  "distance_bucket": "",
  "scraped_for_timestamp": null,
  "rival_route_distance": null,
  "is_surged": null,
  "remarks": null,
  "serviceable": null
}
